{
  "schema_version": "1.0",
  "package_id": "cn-wage-conversion-2025",
  "version": "2025.1",
  "jurisdiction_scope": "national",
  "applicable_jurisdictions": ["中华人民共和国境内"],
  "effective_from": "2025-01-01",
  "effective_to": null,
  "published_at": "2025-01-01",
  "source": {
    "title": "人力资源社会保障部关于职工全年月平均工作时间和工资折算问题的通知",
    "issuer": "人力资源社会保障部",
    "document_number": "人社部发〔2025〕2号",
    "url": "https://www.gov.cn/zhengce/zhengceku/202501/content_6995777.htm",
    "retrieved_at": "2026-08-24T00:00:00+08:00"
  },
  "values": {
    "monthly_paid_days": {
      "value": "21.75",
      "unit": "day/month",
      "effective_from": "2025-01-01",
      "effective_to": null,
      "source_locator": "第二条日工资、小时工资折算"
    },
    "daily_hours": {
      "value": "8",
      "unit": "hour/day",
      "effective_from": "2025-01-01",
      "effective_to": null,
      "source_locator": "第一条工作小时数计算"
    }
  }
}
